{"blockers":[],"contract_name":"official-document-source-catalog","inventory_locator":"https://www.quantum-espresso.org/Doc/","license":{"allowed_storage_modes":["metadata-only","external-runtime-only"],"assessment":"unresolved","identity":{"identifier":null,"terms_urls":["https://www.quantum-espresso.org/Doc/user_guide/node6.html"],"verification":"unknown"},"limitations":["Only metadata and external receipts are stored; provider text is not embedded."],"official_terms_locator":"https://www.quantum-espresso.org/Doc/user_guide/node6.html"},"limitations":["The selected pages are version-labeled but the official web corpus remains rolling and incomplete."],"losses":[],"reviewed_exclusions":[],"schema_version":"1.0","sources":[{"disposition":"included","external_identity":{"kind":"external-receipt","raw_bytes":6604,"raw_sha256":"b8b1193c4f2723310151d7825240f9b20fe2212d1e0f509cce89988a93f7a14a","retrieved_utc":"2026-07-17T11:49:00Z","value":"qe-7.5:qe-input-bands"},"locator":"https://www.quantum-espresso.org/Doc/INPUT_BANDS.txt","slices":[{"external_receipt":{"raw_bytes":6604,"raw_sha256":"b8b1193c4f2723310151d7825240f9b20fe2212d1e0f509cce89988a93f7a14a","retrieval_method":"https-get","retrieved_utc":"2026-07-17T11:49:00Z","selected_bytes":6604,"selected_sha256":"b8b1193c4f2723310151d7825240f9b20fe2212d1e0f509cce89988a93f7a14a"},"loss_ids":[],"order":0,"selector":{"kind":"whole-source","layer":"raw-source","value":"*"},"slice_id":"qe-input-bands:whole","subject_ids":["qe:bands-artifacts"],"title":"QE 7.5 INPUT_BANDS"}],"source_id":"qe-input-bands","source_kind":"reference-page","title":"QE 7.5 INPUT_BANDS"},{"disposition":"included","external_identity":{"kind":"external-receipt","raw_bytes":5896,"raw_sha256":"d18fa270d3ca41b3bed586c40bb9cf5fb2b67962e741381a75bea23b6601eff3","retrieved_utc":"2026-07-17T11:49:00Z","value":"qe-7.5:qe-input-dos"},"locator":"https://www.quantum-espresso.org/Doc/INPUT_DOS.txt","slices":[{"external_receipt":{"raw_bytes":5896,"raw_sha256":"d18fa270d3ca41b3bed586c40bb9cf5fb2b67962e741381a75bea23b6601eff3","retrieval_method":"https-get","retrieved_utc":"2026-07-17T11:49:00Z","selected_bytes":5896,"selected_sha256":"d18fa270d3ca41b3bed586c40bb9cf5fb2b67962e741381a75bea23b6601eff3"},"loss_ids":[],"order":0,"selector":{"kind":"whole-source","layer":"raw-source","value":"*"},"slice_id":"qe-input-dos:whole","subject_ids":["qe:dos-projection-artifacts"],"title":"QE 7.5 INPUT_DOS"}],"source_id":"qe-input-dos","source_kind":"reference-page","title":"QE 7.5 INPUT_DOS"},{"disposition":"included","external_identity":{"kind":"external-receipt","raw_bytes":14081,"raw_sha256":"2fe26603465c910cec30dd5da42fb157e6e9135b8d099e01130833232df8c01c","retrieved_utc":"2026-07-17T11:49:00Z","value":"qe-7.5:qe-input-projwfc"},"locator":"https://www.quantum-espresso.org/Doc/INPUT_PROJWFC.txt","slices":[{"external_receipt":{"raw_bytes":14081,"raw_sha256":"2fe26603465c910cec30dd5da42fb157e6e9135b8d099e01130833232df8c01c","retrieval_method":"https-get","retrieved_utc":"2026-07-17T11:49:00Z","selected_bytes":14081,"selected_sha256":"2fe26603465c910cec30dd5da42fb157e6e9135b8d099e01130833232df8c01c"},"loss_ids":[],"order":0,"selector":{"kind":"whole-source","layer":"raw-source","value":"*"},"slice_id":"qe-input-projwfc:whole","subject_ids":["qe:dos-projection-artifacts"],"title":"QE 7.5 INPUT_PROJWFC"}],"source_id":"qe-input-projwfc","source_kind":"reference-page","title":"QE 7.5 INPUT_PROJWFC"},{"disposition":"included","external_identity":{"kind":"external-receipt","raw_bytes":57125,"raw_sha256":"482dc70016a4638b18eca0219e56754e09fa195524a55decd6df3e6fbc5efd1c","retrieved_utc":"2026-07-17T11:49:00Z","value":"qe-7.5:qe-input-pp"},"locator":"https://www.quantum-espresso.org/Doc/INPUT_PP.html","slices":[{"external_receipt":{"raw_bytes":57125,"raw_sha256":"482dc70016a4638b18eca0219e56754e09fa195524a55decd6df3e6fbc5efd1c","retrieval_method":"https-get","retrieved_utc":"2026-07-17T11:49:00Z","selected_bytes":57125,"selected_sha256":"482dc70016a4638b18eca0219e56754e09fa195524a55decd6df3e6fbc5efd1c"},"loss_ids":[],"order":0,"selector":{"kind":"whole-source","layer":"raw-source","value":"*"},"slice_id":"qe-input-pp:whole","subject_ids":["qe:grid-artifacts"],"title":"QE 7.5 INPUT_PP"}],"source_id":"qe-input-pp","source_kind":"reference-page","title":"QE 7.5 INPUT_PP"},{"disposition":"included","external_identity":{"kind":"external-receipt","raw_bytes":7356,"raw_sha256":"d493ae0332d60c865e904223a7db8a6b426570c1a07032946e186c869d5ca4ea","retrieved_utc":"2026-07-17T11:49:00Z","value":"qe-7.5:qe-input-q2r"},"locator":"https://www.quantum-espresso.org/Doc/INPUT_Q2R.txt","slices":[{"external_receipt":{"raw_bytes":7356,"raw_sha256":"d493ae0332d60c865e904223a7db8a6b426570c1a07032946e186c869d5ca4ea","retrieval_method":"https-get","retrieved_utc":"2026-07-17T11:49:00Z","selected_bytes":7356,"selected_sha256":"d493ae0332d60c865e904223a7db8a6b426570c1a07032946e186c869d5ca4ea"},"loss_ids":[],"order":0,"selector":{"kind":"whole-source","layer":"raw-source","value":"*"},"slice_id":"qe-input-q2r:whole","subject_ids":["qe:phonon-epc-artifacts"],"title":"QE 7.5 INPUT_Q2R"}],"source_id":"qe-input-q2r","source_kind":"reference-page","title":"QE 7.5 INPUT_Q2R"},{"disposition":"included","external_identity":{"kind":"external-receipt","raw_bytes":20467,"raw_sha256":"e162a380590814b4ce7bce383261cbcae2567f7e9c21de8655af446082691b91","retrieved_utc":"2026-07-17T11:49:00Z","value":"qe-7.5:qe-input-matdyn"},"locator":"https://www.quantum-espresso.org/Doc/INPUT_MATDYN.txt","slices":[{"external_receipt":{"raw_bytes":20467,"raw_sha256":"e162a380590814b4ce7bce383261cbcae2567f7e9c21de8655af446082691b91","retrieval_method":"https-get","retrieved_utc":"2026-07-17T11:49:00Z","selected_bytes":20467,"selected_sha256":"e162a380590814b4ce7bce383261cbcae2567f7e9c21de8655af446082691b91"},"loss_ids":[],"order":0,"selector":{"kind":"whole-source","layer":"raw-source","value":"*"},"slice_id":"qe-input-matdyn:whole","subject_ids":["qe:phonon-epc-artifacts"],"title":"QE 7.5 INPUT_MATDYN"}],"source_id":"qe-input-matdyn","source_kind":"reference-page","title":"QE 7.5 INPUT_MATDYN"},{"disposition":"included","external_identity":{"kind":"external-receipt","raw_bytes":8143,"raw_sha256":"4da654f7ed8ec6ceb5d38a4e470389b2fb414999eb5233e083ea454c2669470e","retrieved_utc":"2026-07-17T11:49:00Z","value":"qe-7.5:qe-input-dynmat"},"locator":"https://www.quantum-espresso.org/Doc/INPUT_DYNMAT.txt","slices":[{"external_receipt":{"raw_bytes":8143,"raw_sha256":"4da654f7ed8ec6ceb5d38a4e470389b2fb414999eb5233e083ea454c2669470e","retrieval_method":"https-get","retrieved_utc":"2026-07-17T11:49:00Z","selected_bytes":8143,"selected_sha256":"4da654f7ed8ec6ceb5d38a4e470389b2fb414999eb5233e083ea454c2669470e"},"loss_ids":[],"order":0,"selector":{"kind":"whole-source","layer":"raw-source","value":"*"},"slice_id":"qe-input-dynmat:whole","subject_ids":["qe:phonon-epc-artifacts"],"title":"QE 7.5 INPUT_DYNMAT"}],"source_id":"qe-input-dynmat","source_kind":"reference-page","title":"QE 7.5 INPUT_DYNMAT"}],"subjects":[{"category":"output-observable","evidence_class":"official-provider-required","requirement_strength":"required","subject_id":"qe:bands-artifacts","title":"QE bands artifacts and their producer interface are provider-defined."},{"category":"output-observable","evidence_class":"official-provider-required","requirement_strength":"required","subject_id":"qe:dos-projection-artifacts","title":"QE DOS and projected-DOS artifacts are provider-defined."},{"category":"output-observable","evidence_class":"official-provider-required","requirement_strength":"required","subject_id":"qe:phonon-epc-artifacts","title":"QE phonon and EPC postprocessing artifacts are provider-defined."},{"category":"output-observable","evidence_class":"official-provider-required","requirement_strength":"required","subject_id":"qe:grid-artifacts","title":"QE pp.x real-space outputs are provider-defined."}],"upstream_universe_complete":false,"version_scope":{"kind":"exact","retrieved_utc":null,"snapshot_identity":null,"value":"7.5"}}
