{"blockers":[],"contract_name":"official-document-source-catalog","inventory_locator":"https://github.com/vaspkit/vaspkit.github.io/tree/383a7103505b5b9436dedbf04df42ebb6e248638","license":{"allowed_storage_modes":["metadata-only","external-runtime-only"],"assessment":"unresolved","identity":{"identifier":null,"terms_urls":["https://vaspkit.com/installation.html"],"verification":"unknown"},"limitations":["Only metadata and external receipts are stored; provider text is not embedded."],"official_terms_locator":"https://vaspkit.com/installation.html"},"limitations":["The documentation commit does not establish exact binary identity or redistribution rights."],"losses":[],"reviewed_exclusions":[],"schema_version":"1.0","sources":[{"disposition":"included","external_identity":{"kind":"revision","raw_bytes":149377,"raw_sha256":"5a3f882c267b8da23d029861b9cbde3b9213f31e551b12df5e4bdc86e0bf6c59","retrieved_utc":"2026-07-24T00:00:00Z","value":"383a7103505b5b9436dedbf04df42ebb6e248638"},"locator":"https://raw.githubusercontent.com/vaspkit/vaspkit.github.io/383a7103505b5b9436dedbf04df42ebb6e248638/_sources/tutorials.rst.txt","slices":[{"external_receipt":{"raw_bytes":149377,"raw_sha256":"5a3f882c267b8da23d029861b9cbde3b9213f31e551b12df5e4bdc86e0bf6c59","retrieval_method":"https-get","retrieved_utc":"2026-07-24T00:00:00Z","selected_bytes":149377,"selected_sha256":"5a3f882c267b8da23d029861b9cbde3b9213f31e551b12df5e4bdc86e0bf6c59"},"loss_ids":[],"order":0,"selector":{"kind":"whole-source","layer":"raw-source","value":"*"},"slice_id":"vaspkit-tutorials:whole","subject_ids":["vaspkit:band-table"],"title":"VASPKIT tutorial source"}],"source_id":"vaspkit-tutorials","source_kind":"source-documentation","title":"VASPKIT tutorial source"}],"subjects":[{"category":"output-observable","evidence_class":"official-provider-required","requirement_strength":"required","subject_id":"vaspkit:band-table","title":"VASPKIT band-table and k-label outputs are provider-defined."}],"upstream_universe_complete":false,"version_scope":{"kind":"revision","retrieved_utc":null,"snapshot_identity":null,"value":"383a7103505b5b9436dedbf04df42ebb6e248638"}}
