{
  "blockers": [
    {
      "code": "DOC.BODY.BYTES.EXTERNAL",
      "dimensions": ["corpus","slices"],
      "description": "Official documentation bodies and per-page hashes are external, so provider-required subjects remain blocked."
    },
    {
      "code": "DOC.BUILD.REPLAY.MISSING",
      "dimensions": ["slices"],
      "description": "The exact generated documentation build and API closure are not reproduced."
    }
  ],
  "contract_name": "official-document-source-catalog",
  "inventory_locator": "https://github.com/deepmodeling/deepmd-kit/tree/v3.1.3",
  "license": {
    "allowed_storage_modes": [
      "metadata-only",
      "external-runtime-only"
    ],
    "assessment": "conditional",
    "identity": {
      "identifier": "LGPL-3.0-or-later",
      "terms_urls": [
        "https://raw.githubusercontent.com/deepmodeling/deepmd-kit/b2c8511ee32355e744e17e05d95c6d8acbac9526/LICENSE"
      ],
      "verification": "verified"
    },
    "limitations": [
      "Framework source licensing does not grant rights to tutorial datasets, trained models, reference DFT outputs, optional backends, or third-party assets."
    ],
    "official_terms_locator": "https://raw.githubusercontent.com/deepmodeling/deepmd-kit/b2c8511ee32355e744e17e05d95c6d8acbac9526/LICENSE"
  },
  "limitations": [
    "This exact metadata inventory does not establish dependency compatibility, native CLI behavior, backend equivalence, model validity, or scientific acceptance.",
    "External raw identity is the SHA-256 of canonical sorted git ls-tree -r receipt lines '<mode> <object_type> <object_id>\\t<path>\\n' for every inventory entry; the local inventory JSON is metadata evidence only and contains no official document body bytes."
  ],
  "losses": [
    {
      "affected_source_ids": [
        "deepmd-exact-document-tree-inventory"
      ],
      "description": "Only exact Git path and object metadata are retained; official documentation body bytes remain external.",
      "disposition": "external-only",
      "loss_id": "document-bodies-not-retained",
      "materiality": "material",
      "stage": "storage"
    },
    {
      "affected_source_ids": [
        "deepmd-exact-document-tree-inventory"
      ],
      "description": "Generated API/reference pages and the exact documentation build have not been replayed.",
      "disposition": "blocked",
      "loss_id": "generated-build-not-replayed",
      "materiality": "material",
      "stage": "extraction"
    },
    {
      "affected_source_ids": [
        "deepmd-exact-document-tree-inventory"
      ],
      "description": "Tutorial datasets, NumPy/HDF5 payloads, checkpoints, models, pickles, and other executable or serialized artifacts are metadata-only and are never loaded.",
      "disposition": "external-only",
      "loss_id": "runtime-artifacts-excluded",
      "materiality": "material",
      "stage": "storage"
    }
  ],
  "reviewed_exclusions": [],
  "schema_version": "1.0",
  "sources": [
    {
      "disposition": "included",
      "external_identity": {
        "evidence_sha256": "c8e88a1d4343441469df01787bebf54a5749732cf44e26a7b3537637e1ddadc4",
        "kind": "revision",
        "raw_bytes": 46767,
        "raw_sha256": "9389d61550e503bbab1ae1da05468ee209cf29392ca95ada91083434c80ba816",
        "retrieved_utc": "2026-07-23T20:17:38Z",
        "value": "commit:b2c8511ee32355e744e17e05d95c6d8acbac9526;root-tree:0c195d51278d309fa81b9d4a7b4a77e7af949b68"
      },
      "locator": "https://github.com/deepmodeling/deepmd-kit/tree/v3.1.3",
      "metadata_evidence_ref": {
        "bytes": 92800,
        "path": "skills/deepmd-rigorous-workflows/references/source-pack-inventory-deepmd.json",
        "sha256": "c8e88a1d4343441469df01787bebf54a5749732cf44e26a7b3537637e1ddadc4"
      },
      "slices": [
        {
          "external_receipt": {
            "raw_bytes": 46767,
            "raw_sha256": "9389d61550e503bbab1ae1da05468ee209cf29392ca95ada91083434c80ba816",
            "retrieval_method": "git-object",
            "retrieved_utc": "2026-07-23T20:17:38Z",
            "selected_bytes": 46767,
            "selected_sha256": "9389d61550e503bbab1ae1da05468ee209cf29392ca95ada91083434c80ba816"
          },
          "loss_ids": [
            "document-bodies-not-retained",
            "generated-build-not-replayed",
            "runtime-artifacts-excluded"
          ],
          "order": 0,
          "selector": {
            "kind": "whole-source",
            "layer": "raw-source",
            "value": "*"
          },
          "slice_id": "deepmd-exact-document-tree-inventory.whole",
          "subject_ids": [
            "deepmd.install.pytorch-cpu-pip",
            "deepmd.probe.identity",
            "deepmd.schema.training-input",
            "deepmd.data.neighbor-stat",
            "deepmd.train.pytorch",
            "deepmd.restart.pytorch",
            "deepmd.freeze.pytorch",
            "deepmd.compress.pytorch",
            "deepmd.test.all-frames",
            "deepmd.model-deviation",
            "deepmd.infer.python",
            "deepmd.deploy.lammps"
          ],
          "title": "Complete documentation-tree metadata inventory"
        }
      ],
      "source_id": "deepmd-exact-document-tree-inventory",
      "source_kind": "index",
      "title": "Exact release documentation-tree metadata inventory"
    }
  ],
  "subjects": [
    {
      "category": "workflow",
      "evidence_class": "official-provider-required",
      "requirement_strength": "required",
      "subject_id": "deepmd.install.pytorch-cpu-pip",
      "title": "deepmd install pytorch-cpu-pip"
    },
    {
      "category": "workflow",
      "evidence_class": "official-provider-required",
      "requirement_strength": "required",
      "subject_id": "deepmd.probe.identity",
      "title": "deepmd probe identity"
    },
    {
      "category": "workflow",
      "evidence_class": "official-provider-required",
      "requirement_strength": "required",
      "subject_id": "deepmd.schema.training-input",
      "title": "deepmd schema training-input"
    },
    {
      "category": "workflow",
      "evidence_class": "official-provider-required",
      "requirement_strength": "required",
      "subject_id": "deepmd.data.neighbor-stat",
      "title": "deepmd data neighbor-stat"
    },
    {
      "category": "workflow",
      "evidence_class": "official-provider-required",
      "requirement_strength": "required",
      "subject_id": "deepmd.train.pytorch",
      "title": "deepmd train pytorch"
    },
    {
      "category": "workflow",
      "evidence_class": "official-provider-required",
      "requirement_strength": "required",
      "subject_id": "deepmd.restart.pytorch",
      "title": "deepmd restart pytorch"
    },
    {
      "category": "workflow",
      "evidence_class": "official-provider-required",
      "requirement_strength": "required",
      "subject_id": "deepmd.freeze.pytorch",
      "title": "deepmd freeze pytorch"
    },
    {
      "category": "workflow",
      "evidence_class": "official-provider-required",
      "requirement_strength": "required",
      "subject_id": "deepmd.compress.pytorch",
      "title": "deepmd compress pytorch"
    },
    {
      "category": "workflow",
      "evidence_class": "official-provider-required",
      "requirement_strength": "required",
      "subject_id": "deepmd.test.all-frames",
      "title": "deepmd test all-frames"
    },
    {
      "category": "workflow",
      "evidence_class": "official-provider-required",
      "requirement_strength": "required",
      "subject_id": "deepmd.model-deviation",
      "title": "deepmd model-deviation"
    },
    {
      "category": "workflow",
      "evidence_class": "official-provider-required",
      "requirement_strength": "required",
      "subject_id": "deepmd.infer.python",
      "title": "deepmd infer python"
    },
    {
      "category": "workflow",
      "evidence_class": "official-provider-required",
      "requirement_strength": "required",
      "subject_id": "deepmd.deploy.lammps",
      "title": "deepmd deploy lammps"
    }
  ],
  "upstream_universe_complete": true,
  "version_scope": {
    "kind": "exact",
    "retrieved_utc": null,
    "snapshot_identity": null,
    "value": "3.1.3"
  }
}
