{"blockers":[],"contract_name":"official-document-source-catalog","inventory_locator":"https://github.com/Maxwell3919/Vibe-DFT-Skills/tree/24dd8a9b7fd2758a7c44b82ee7dbb386693b2315/contracts","license":{"allowed_storage_modes":["metadata-only","excluded"],"assessment":"unresolved","identity":{"identifier":null,"terms_urls":[],"verification":"unknown"},"limitations":["No root repository license was found; no literature right is inferred from repository provenance."],"official_terms_locator":"https://github.com/Maxwell3919/Vibe-DFT-Skills"},"limitations":["This provider is a repository-interface carrier only and contains no external literature subject.","The open-ended runtime literature universe is deliberately outside this catalog."],"losses":[{"affected_source_ids":["literature-plan-repository-source-index"],"description":"Repository contracts and policies remain exact local references and are not duplicated in this metadata catalog.","disposition":"external-only","loss_id":"repository-bodies-external","materiality":"non-material","stage":"storage"}],"reviewed_exclusions":[],"schema_version":"1.0","sources":[{"disposition":"included","external_identity":{"kind":"revision","raw_bytes":734,"raw_sha256":"38428edeee00c1f3e9667f1e42d6b26ac3c6504a135492cf8284d1200deb78c8","retrieved_utc":"2026-07-23T20:02:38Z","value":"24dd8a9b7fd2758a7c44b82ee7dbb386693b2315:skills/literature-to-dft-plan/references/official-source-index.json"},"locator":"https://raw.githubusercontent.com/Maxwell3919/Vibe-DFT-Skills/24dd8a9b7fd2758a7c44b82ee7dbb386693b2315/skills/literature-to-dft-plan/references/official-source-index.json","slices":[{"external_receipt":{"raw_bytes":734,"raw_sha256":"38428edeee00c1f3e9667f1e42d6b26ac3c6504a135492cf8284d1200deb78c8","retrieval_method":"git-object","retrieved_utc":"2026-07-23T20:02:38Z","selected_bytes":734,"selected_sha256":"38428edeee00c1f3e9667f1e42d6b26ac3c6504a135492cf8284d1200deb78c8"},"loss_ids":["repository-bodies-external"],"order":0,"selector":{"kind":"whole-source","layer":"raw-source","value":"*"},"slice_id":"literature-plan-repository-source-index-whole","subject_ids":[],"title":"Exact repository source-policy index"}],"source_id":"literature-plan-repository-source-index","source_kind":"index","title":"literature-to-dft-plan repository source policy"}],"subjects":[],"upstream_universe_complete":false,"version_scope":{"kind":"revision","retrieved_utc":"2026-07-23T20:02:38Z","snapshot_identity":null,"value":"24dd8a9b7fd2758a7c44b82ee7dbb386693b2315"}}
